{
  "id": "cmt_01JAB3QK7M9P2V6XWN0T4Y8ZB5",
  "projectId": "prj_01JAB3QK7M9P2V6XWN0T4Y8ZB5",
  "parents": [],
  "batch": {
    "id": "bat_01JAB3QK7M9P2V6XWN0T4Y8ZB5",
    "author": {
      "kind": "user"
    },
    "label": "Set the tempo",
    "ops": [
      {
        "op": "tempo.set",
        "tempoMap": [
          {
            "tick": 0,
            "bpm": 118,
            "curve": "step"
          }
        ]
      }
    ],
    "createdAt": "2026-10-18T12:00:00Z"
  },
  "snapshot": "sha256:d4d4d4d4d4d4d4d4d4d4d4d4d4d4d4d4d4d4d4d4d4d4d4d4d4d4d4d4d4d4d4d4",
  "state": "committed",
  "deviceId": "device-1",
  "createdAt": "2026-10-18T12:00:00Z"
}
